{"$schema":"http://json-schema.org/draft-07/schema#","description":"Ordered list of checkpoints for one feature or migration. Written by the checkpoint-planner skill, reviewed by the human in the viewer.","properties":{"checkpoints":{"items":{"properties":{"description":{"description":"One paragraph: scope of this checkpoint.","type":"string"},"done_criteria":{"description":"Concrete, checkable conditions for 'this checkpoint is done'.","items":{"type":"string"},"minItems":1,"type":"array"},"evidence":{"description":"Path to archived evidence for this checkpoint, e.g. .helix/evidence/cp-01/.","type":"string"},"gates":{"properties":{"adversarial":{"enum":["pending","passed","failed","skipped"],"type":"string"},"behavior":{"enum":["pending","passed","failed","skipped"],"type":"string"},"human":{"enum":["pending","passed","failed","skipped"],"type":"string"},"ui":{"enum":["pending","passed","failed","skipped"],"type":"string"}},"type":"object"},"id":{"description":"Stable id, e.g. cp-01. Order in the array is the build order.","pattern":"^cp-[0-9]{2}$","type":"string"},"needs_ui_gate":{"description":"False for logic-only checkpoints (they skip Gate 2 with a recorded reason).","type":"boolean"},"status":{"default":"planned","enum":["planned","in_progress","done"],"type":"string"},"title":{"description":"A few words. The human reviews the sequence, not essays.","maxLength":80,"type":"string"}},"required":["id","title","description","needs_ui_gate","done_criteria"],"type":"object"},"minItems":1,"type":"array"},"reference":{"description":"The reference used as the spec: path to existing screen/app, or design/doc paths for new work.","type":"string"},"target":{"description":"What is being built or migrated, in one line.","type":"string"},"version":{"const":1,"type":"integer"}},"required":["version","target","checkpoints"],"title":"Helix Loop checkpoint plan","type":"object"}