{"checkpoints":[{"description":"Empty settings screen: navigation bar with title, back action, and the section list container. No rows yet.","done_criteria":["Screen renders with correct nav bar title and back button","Navigating back returns to the previous screen","Empty section container present with correct top spacing"],"gates":{"adversarial":"pending","behavior":"pending","human":"pending","ui":"pending"},"id":"cp-01","needs_ui_gate":true,"status":"planned","title":"Screen skeleton with nav bar"},{"description":"First content section: avatar, name, and email rows, read-only, matching the reference layout.","done_criteria":["Avatar, name, and email render from the user model","Rows match reference spacing and typography","Empty/long-name edge cases handled"],"gates":{"adversarial":"pending","behavior":"pending","human":"pending","ui":"pending"},"id":"cp-02","needs_ui_gate":true,"status":"planned","title":"Profile section rows"},{"description":"Preferences section with working toggles persisted to the settings store.","done_criteria":["Each toggle flips and persists across app restart","Toggle states match the stored preferences on load","Disabled state shown when notifications are off at OS level"],"gates":{"adversarial":"pending","behavior":"pending","human":"pending","ui":"pending"},"id":"cp-03","needs_ui_gate":true,"status":"planned","title":"Notification preferences toggles"},{"description":"Sign-out action clears session and credentials, returns to the login screen. No new visuals.","done_criteria":["Session tokens cleared from secure storage on sign-out","User lands on login screen with no back-navigation to settings","Sign-out during a pending sync does not corrupt local data"],"gates":{"adversarial":"pending","behavior":"pending","human":"pending","ui":"skipped"},"id":"cp-04","needs_ui_gate":false,"status":"planned","title":"Sign-out flow (logic only)"}],"reference":"legacy-app/src/screens/Settings/","target":"Migrate the Settings screen from the legacy app to the new native app","version":1}